[
  {
    "attribution_id": "attr:install-1",
    "tenant_id": "tenant-a",
    "app_id": "app-a",
    "subject_scope": "installation_level",
    "subject_ref": "installation:install-1",
    "reason_code_version": "0.4.0",
    "evidence_refs": [
      {
        "tenant_id": "tenant-a",
        "app_id": "app-a",
        "ref": "click-1",
        "lifecycle_status": "available",
        "access_class": "protected"
      },
      {
        "tenant_id": "tenant-a",
        "app_id": "app-a",
        "ref": "install-1",
        "lifecycle_status": "available",
        "access_class": "protected"
      }
    ],
    "effective_at": "2026-08-06T00:00:00.000Z",
    "decided_at": "2026-08-12T00:00:00.000Z",
    "input_cutoff_at": "2026-08-12T00:00:00.000Z",
    "finality": "final",
    "rule_bundle_id": "attribution-default",
    "rule_bundle_version": "0.3.0",
    "rule_bundle_hash": "0000000000000000000000000000000000000000000000000000000000000000",
    "status": "non_organic",
    "method": "install_referrer",
    "model": "last_click",
    "reason_code": "valid_install_referrer"
  }
]
